"--- Welcome to Employee Payroll  Program On MySQL DB "

------------------------------------------------------------------------
UC1--> Create a database Payroll_service and Show and Used that data base
------------------------------------------------------------------------

mysql> create database payroll_service;
Query OK, 1 row affected (0.01 sec)

mysql> CREATE DATABASE payroll_service;
Query OK, 1 row affected (0.27 sec)

mysql> show databases;
+--------------------+
| Database           |
+--------------------+
| information_schema |
| mysql              |
| payroll_service    |
| performance_schema |
| pets               |
| sakila             |
| sys                |
| testdb             |
| world              |
+--------------------+
9 rows in set (0.02 sec)

mysql> USE payroll_service;
Database changed

-----------------------------------------------------------------------
UC2-->Create a Table inside the Payroll database
-----------------------------------------------------------------------
mysql> create table employee_payroll(id int unsigned Not Null Auto_Increment,
    -> name varchar(30) Not Null,
    -> salary Double Not Null,
    -> start Date Not Null,
    -> Primary Key (id)
    -> );
Query OK, 0 rows affected (4.18 sec)

mysql> describe employee_payroll;
+--------+--------------+------+-----+---------+----------------+
| Field  | Type         | Null | Key | Default | Extra          |
+--------+--------------+------+-----+---------+----------------+
| id     | int unsigned | NO   | PRI | NULL    | auto_increment |
| name   | varchar(30)  | NO   |     | NULL    |                |
| salary | double       | NO   |     | NULL    |                |
| start  | date         | NO   |     | NULL    |                |
+--------+--------------+------+-----+---------+----------------+
4 rows in set (0.18 sec)

--------------------------------------------------------------------
UC3--> Inserting dat into a EmployeePayroll table
--------------------------------------------------------------------
mysql> insert into employee_payroll(name,salary,start)values
    -> ('Srinivas','500000','2018-05-01'),
    -> ('Anil','25000','2019-06-05'),
    -> ('Babu','60000','2020-02-25');
Query OK, 3 rows affected (0.93 sec)
Records: 3  Duplicates: 0  Warnings: 0

----------------------------------------------------
UC4--> Retrieve the data Employee_payroll data
----------------------------------------------------

mysql> select * from employee_payroll;
+----+----------+--------+------------+
| id | name     | salary | start      |
+----+----------+--------+------------+
|  1 | Srinivas | 500000 | 2018-05-01 |
|  2 | Anil     |  25000 | 2019-06-05 |
|  3 | Balu     |  60000 | 2020-02-22 |
+----+----------+--------+------------+
3 rows in set (0.10 sec)

--------------------------------------------------------------
UC5-->Ability to retrieve salary data for particular employee
---------------------------------------------------------------
mysql> select salary from employee_payroll where name = 'Anil';
+--------+
| salary |
+--------+
|  25000 |
+--------+
1 row in set (0.20 sec)

mysql> select * from employee_payroll where start between cast('2019-01-01' as date) and date (now());
+----+------+--------+------------+
| id | name | salary | start      |
+----+------+--------+------------+
|  2 | Anil |  25000 | 2019-06-05 |
|  3 | Babu |  60000 | 2020-02-25 |
+----+------+--------+------------+
2 rows in set (0.18 sec)

-----------------------------------------------------------------------
UC6-->Ability to add gender to employee
------------------------------------------------------------------------

mysql> alter table employee_payroll add gender char(1) after name;
Query OK, 0 rows affected (1.24 sec)
Records: 0  Duplicates: 0  Warnings: 0

mysql> describe employee_payroll;
+--------+--------------+------+-----+---------+----------------+
| Field  | Type         | Null | Key | Default | Extra          |
+--------+--------------+------+-----+---------+----------------+
| id     | int unsigned | NO   | PRI | NULL    | auto_increment |
| name   | varchar(30)  | NO   |     | NULL    |                |
| gender | char(1)      | YES  |     | NULL    |                |
| salary | double       | NO   |     | NULL    |                |
| start  | date         | NO   |     | NULL    |                |
+--------+--------------+------+-----+---------+----------------+
5 rows in set (0.00 sec)
mysql> update employee_payroll set gender ='M' where name ='Srinivas' or name='Babu';

Query OK, 2 rows affected (0.01 sec)
Rows matched: 2  Changed: 2  Warnings: 0

mysql> update employee_payroll set gender ='F' where name ='Anil';

Query OK, 1 row affected (0.01 sec)
Rows matched: 1  Changed: 1  Warnings: 0

mysql> select * from employee_payroll;

+----+----------+--------+--------+------------+
| id | name     | gender | salary | start      |
+----+----------+--------+--------+------------+
|  1 | Srinivas | M      | 500000 | 2018-05-01 |
|  2 | Anil     | F      |  25000 | 2019-06-05 |
|  3 | Babu     | M      |  60000 | 2020-02-25 |
+----+----------+--------+--------+------------+
3 rows in set (0.00 sec)

-------------------------------------------------------------------
UC7-->Ability to find sum,avg,min,max and number males and females
-------------------------------------------------------------------
mysql> select sum(salary) from employee_payroll where gender ='M' group by gender;
+-------------+
| sum(salary) |
+-------------+
|      560000 |
+-------------+
1 row in set (0.16 sec)

mysql> select sum(salary) from employee_payroll where gender ='F' group by gender;
+-------------+
| sum(salary) |
+-------------+
|       25000 |
+-------------+
1 row in set (0.00 sec)

mysql> select avg(salary) from employee_payroll where gender ='M' group by gender;
+-------------+
| avg(salary) |
+-------------+
|      280000 |
+-------------+
1 row in set (0.00 sec)

mysql> select avg(salary) from employee_payroll where gender ='f' group by gender;
+-------------+
| avg(salary) |
+-------------+
|       25000 |
+-------------+
1 row in set (0.00 sec)

mysql> select max(salary) from employee_payroll where gender ='M' group by gender;
+-------------+
| max(salary) |
+-------------+
|      500000 |
+-------------+
1 row in set (0.01 sec)

mysql> select min(salary) from employee_payroll where gender ='M' group by gender;
+-------------+
| min(salary) |
+-------------+
|       60000 |
+-------------+
1 row in set (0.00 sec)

mysql> select gender , avg(salary) from employee_payroll group by gender;
+--------+-------------+
| gender | avg(salary) |
+--------+-------------+
| M      |      280000 |
| F      |       25000 |
+--------+-------------+
2 rows in set (0.17 sec)

mysql> select gender , count(name) from employee_payroll group by gender;
+--------+-------------+
| gender | count(name) |
+--------+-------------+
| M      |           2 |
| F      |           1 |
+--------+-------------+
2 rows in set (0.00 sec)

------------------------------------------------------------------------------------------------------------------------
UC8-->Ability to extend employee_payroll data to store employee information like employee phone, address and department
-------------------------------------------------------------------------------------------------------------------------

mysql> alter table employee_payroll add phoneNumber varchar(30) after name;
Query OK, 0 rows affected (8.04 sec)
Records: 0  Duplicates: 0  Warnings: 0

mysql> alter table employee_payroll add address varchar(250) after PhoneNumber;
Query OK, 0 rows affected (1.17 sec)
Records: 0  Duplicates: 0  Warnings: 0

mysql> alter table employee_payroll add department varchar(250) not null after address;
Query OK, 0 rows affected (0.86 sec)
Records: 0  Duplicates: 0  Warnings: 0

mysql> alter table employee_payroll alter address set default 'ATP';
Query OK, 0 rows affected (0.31 sec)
Records: 0  Duplicates: 0  Warnings: 0

mysql> describe employee_payroll;
+-------------+--------------+------+-----+---------+----------------+
| Field       | Type         | Null | Key | Default | Extra          |
+-------------+--------------+------+-----+---------+----------------+
| id          | int unsigned | NO   | PRI | NULL    | auto_increment |
| name        | varchar(30)  | NO   |     | NULL    |                |
| phoneNumber | varchar(30)  | YES  |     | NULL    |                |
| address     | varchar(250) | YES  |     | ATP     |                |
| department  | varchar(250) | NO   |     | NULL    |                |
| gender      | char(1)      | YES  |     | NULL    |                |
| salary      | double       | NO   |     | NULL    |                |
| start       | date         | NO   |     | NULL    |                |
+-------------+--------------+------+-----+---------+----------------+
8 rows in set (0.00 sec)

mysql> update  employee_payroll set address=default;
Query OK, 3 rows affected (0.15 sec)
Rows matched: 3  Changed: 3  Warnings: 0

mysql> select * from employee_payroll;
+----+----------+-------------+---------+------------+--------+--------+------------+
| id | name     | phoneNumber | address | department | gender | salary | start      |
+----+----------+-------------+---------+------------+--------+--------+------------+
|  1 | Srinivas | NULL        | ATP     |            | M      | 500000 | 2018-05-01 |
|  2 | Anil     | NULL        | ATP     |            | F      |  25000 | 2019-06-05 |
|  3 | Babu     | NULL        | ATP     |            | M      |  60000 | 2020-02-25 |
+----+----------+-------------+---------+------------+--------+--------+------------+
3 rows in set (0.01 sec)

--------------------------------------------------------------------------------------------------------------
UC9-->Ability to extend  employee_payroll table to have Basic Pay,Deductions, Taxable Pay,Income Tax, Net Pay
-------------------------------------------------------------------------------------------------------------

mysql> alter table employee_payroll  rename column salary to BasicPay;
Query OK, 0 rows affected (1.28 sec)
Records: 0  Duplicates: 0  Warnings: 0

mysql>
mysql> alter table employee_payroll  add Deduction double not null after BasicPay;
Query OK, 0 rows affected (0.57 sec)
Records: 0  Duplicates: 0  Warnings: 0

mysql> alter table employee_payroll  add TaxablePay double not null after Deduction;
Query OK, 0 rows affected (0.58 sec)
Records: 0  Duplicates: 0  Warnings: 0

mysql> alter table employee_payroll  add NetPay double not null after TaxablePay;
Query OK, 0 rows affected (0.56 sec)
Records: 0  Duplicates: 0  Warnings: 0

mysql> alter table employee_payroll  add Tax double not null after netpay;
Query OK, 0 rows affected (0.40 sec)
Records: 0  Duplicates: 0  Warnings: 0

mysql> describe employee_payroll;
+-------------+--------------+------+-----+---------+----------------+
| Field       | Type         | Null | Key | Default | Extra          |
+-------------+--------------+------+-----+---------+----------------+
| id          | int unsigned | NO   | PRI | NULL    | auto_increment |
| name        | varchar(30)  | NO   |     | NULL    |                |
| phoneNumber | varchar(30)  | YES  |     | NULL    |                |
| address     | varchar(250) | YES  |     | ATP     |                |
| department  | varchar(250) | NO   |     | NULL    |                |
| gender      | char(1)      | YES  |     | NULL    |                |
| BasicPay    | double       | NO   |     | NULL    |                |
| Deduction   | double       | NO   |     | NULL    |                |
| TaxablePay  | double       | NO   |     | NULL    |                |
| NetPay      | double       | NO   |     | NULL    |                |
| Tax         | double       | NO   |     | NULL    |                |
| start       | date         | NO   |     | NULL    |                |
+-------------+--------------+------+-----+---------+----------------+
12 rows in set (0.11 sec)

----------------------------------------------------------------------
UC10-->Ability to make Srinivas as part of Sales and Marketing Department
----------------------------------------------------------------------
mysql> insert into employee_payroll(name,department,gender,Basicpay,deduction,taxablepay,netpay,tax,start)values
    -> ('Srinivas','Sales','M','500000','10000','20000','10000','10000','2019-05-23');
Query OK, 1 row affected (0.61 sec)

mysql> select * from employee_payroll where name ='srinivas';
+----+----------+-------------+---------+------------+--------+----------+-----------+------------+--------+-------+------------+
| id | name     | phoneNumber | address | department | gender | BasicPay | Deduction | TaxablePay | NetPay | Tax   | start      |
+----+----------+-------------+---------+------------+--------+----------+-----------+------------+--------+-------+------------+
|  1 | Srinivas | NULL        | ATP     |            | M      |   500000 |         0 |          0 |      0 |     0 | 2018-05-01 |
|  5 | Srinivas | NULL        | ATP     | Sales      | M      |   500000 |     10000 |      20000 |  10000 | 10000 | 2019-05-23 |
+----+----------+-------------+---------+------------+--------+----------+-----------+------------+--------+-------+------------+
2 rows in set (0.07 sec)